{
  "id": "014",
  "synthetic": true,
  "language": "hi",
  "format": "whatsapp",
  "label": "scam_pattern",
  "text": "SYNTHETIC — fictional evaluation material.\n[10/10/26, 6:10 PM] भर्ती डेस्क (काल्पनिक): लाओस में डिजिटल मार्केटिंग का पद है। रोजगार वीज़ा प्रस्थान से पहले मिलेगा।\n[10/10/26, 6:12 PM] भर्ती डेस्क (काल्पनिक): डेढ़ लाख रुपये UPI से आज ही जमा करें, अंतिम दो सीटें। भुगतान की रसीद देंगे।\n[10/10/26, 6:13 PM] भर्ती डेस्क (काल्पनिक): बातचीत केवल WhatsApp पर है, कार्यालय नहीं। पंजीकरण नंबर, अनुबंध और बीमा का विवरण साझा नहीं किया गया है।",
  "expected": {
    "verdict": "STOP",
    "rule_hits": [
      "R3_NO_RC_NUMBER",
      "R4_FEE_OVER_CAP",
      "R5_NO_TRIPARTITE_CONTRACT",
      "R6_HIGH_RISK_CORRIDOR",
      "R7_INFORMAL_CHANNEL_ONLY",
      "R9_PBBY_MISSING",
      "H3_PRESSURE"
    ],
    "facts": {
      "visa_type": "employment",
      "destination_country": "Laos",
      "fees_demanded_inr": "150000",
      "role_title": "digital marketing",
      "agent_rc_number": null
    },
    "recruiter_list_date": "2026-10-01"
  }
}
