{
  "id": "005",
  "synthetic": true,
  "language": "en",
  "format": "whatsapp",
  "label": "scam_pattern",
  "text": "SYNTHETIC — fictional evaluation material.\n[10/10/26, 8:10 PM] Hiring Desk (fictional): Thailand chat support vacancy. Employment visa before travel. No payment requested in this chat; recruitment fee not specified.\n[10/10/26, 8:12 PM] Applicant B (fictional): Can I visit the office and read a contract?\n[10/10/26, 8:13 PM] Hiring Desk (fictional): Recruitment is only on Telegram and WhatsApp, no office address. Registration and contract documents are not available in this chat.",
  "expected": {
    "verdict": "STOP",
    "rule_hits": [
      "R3_NO_RC_NUMBER",
      "R5_NO_TRIPARTITE_CONTRACT",
      "R6_HIGH_RISK_CORRIDOR",
      "R7_INFORMAL_CHANNEL_ONLY",
      "R9_PBBY_MISSING"
    ],
    "facts": {
      "visa_type": "employment",
      "destination_country": "Thailand",
      "fees_demanded_inr": null,
      "role_title": "chat support",
      "agent_rc_number": null
    },
    "recruiter_list_date": "2026-10-01"
  }
}
