{
  "id": "017",
  "synthetic": true,
  "language": "mr",
  "format": "whatsapp",
  "label": "scam_pattern",
  "text": "SYNTHETIC — fictional evaluation material.\n[10/10/26, 9:14 PM] Example संधी केंद्र (fictional): परवाना DEMO-RA-017. लाओसमध्ये ग्राहक सहाय्याची नोकरी. पर्यटक व्हिसावर जा; वर्क परमिट तिथे पोहोचल्यावर मिळेल.\n[10/10/26, 9:15 PM] Example संधी केंद्र (fictional): अडीच लाख रुपये UPI किंवा रोख आजच भरा. पावती किंवा करार देणार नाही. पासपोर्ट पूर्ण नोकरीभर आमच्याकडे जमा करा.\n[10/10/26, 9:16 PM] Example संधी केंद्र (fictional): फक्त WhatsApp +91 90000 00017; कार्यालय नाही. विम्याचा तपशील दिलेला नाही.",
  "expected": {
    "verdict": "STOP",
    "rule_hits": [
      "R1_TOURIST_VISA",
      "R2_RA_NOT_LISTED",
      "R4_FEE_OVER_CAP",
      "R5_NO_TRIPARTITE_CONTRACT",
      "R6_HIGH_RISK_CORRIDOR",
      "R7_INFORMAL_CHANNEL_ONLY",
      "R8_NO_RECEIPT",
      "R9_PBBY_MISSING",
      "H2_PASSPORT_HANDOVER",
      "H3_PRESSURE"
    ],
    "facts": {
      "visa_type": "tourist",
      "destination_country": "Laos",
      "fees_demanded_inr": "250000",
      "role_title": "customer support",
      "agent_rc_number": "DEMO-RA-017"
    },
    "recruiter_list_date": "2026-10-01"
  }
}
