{
  "id": "011",
  "synthetic": true,
  "language": "hi",
  "format": "whatsapp",
  "label": "scam_pattern",
  "text": "SYNTHETIC — fictional evaluation material.\n[10/10/26, 9:14 PM] Example रोज़गार डेस्क (fictional): थाईलैंड में डेटा एंट्री की नौकरी, वेतन १.२ लाख रुपये प्रति माह। पर्यटक वीज़ा पर जाना है, कार्य परमिट पहुँचने के बाद बनेगा।\n[10/10/26, 9:15 PM] Example रोज़गार डेस्क (fictional): २.५ लाख रुपये आज ही UPI पर भेजें। पावती और अनुबंध नहीं देंगे।\n[10/10/26, 9:16 PM] Example रोज़गार डेस्क (fictional): संपर्क केवल WhatsApp +91 90000 00011; कार्यालय का पता और लाइसेंस नंबर उपलब्ध नहीं हैं।",
  "expected": {
    "verdict": "STOP",
    "rule_hits": [
      "R1_TOURIST_VISA",
      "R2_RA_NOT_LISTED",
      "R3_NO_RC_NUMBER",
      "R4_FEE_OVER_CAP",
      "R5_NO_TRIPARTITE_CONTRACT",
      "R6_HIGH_RISK_CORRIDOR",
      "R7_INFORMAL_CHANNEL_ONLY",
      "R8_NO_RECEIPT",
      "R9_PBBY_MISSING",
      "H1_SALARY_ANOMALY",
      "H3_PRESSURE"
    ],
    "facts": {
      "visa_type": "tourist",
      "destination_country": "Thailand",
      "fees_demanded_inr": "250000",
      "role_title": "data entry",
      "agent_rc_number": null
    },
    "recruiter_list_date": "2026-10-01"
  }
}
