{
  "id": "006",
  "synthetic": true,
  "language": "hinglish",
  "format": "whatsapp",
  "label": "scam_pattern",
  "text": "SYNTHETIC — fictional evaluation material.\n[10/10/26, 9:14 PM] Example Nayi Udaan (fictional): Cambodia customer support ka kaam hai. Tourist visa par niklo, work permit pahunchne ke baad banega.\n[10/10/26, 9:15 PM] Example Nayi Udaan (fictional): Rs 2 lakh UPI ya cash aaj hi do, last 2 seats. Receipt aur contract nahi milega. Passport coordinator ke paas jama rahega.\n[10/10/26, 9:16 PM] Example Nayi Udaan (fictional): Sirf WhatsApp +91 90000 00006 ya Telegram; office nahi, licence number nahi dikhayenge.",
  "expected": {
    "verdict": "STOP",
    "rule_hits": [
      "R1_TOURIST_VISA",
      "R2_RA_NOT_LISTED",
      "R3_NO_RC_NUMBER",
      "R4_FEE_OVER_CAP",
      "R5_NO_TRIPARTITE_CONTRACT",
      "R6_HIGH_RISK_CORRIDOR",
      "R7_INFORMAL_CHANNEL_ONLY",
      "R8_NO_RECEIPT",
      "R9_PBBY_MISSING",
      "H2_PASSPORT_HANDOVER",
      "H3_PRESSURE"
    ],
    "facts": {
      "visa_type": "tourist",
      "destination_country": "Cambodia",
      "fees_demanded_inr": "200000",
      "role_title": "customer support",
      "agent_rc_number": null
    },
    "recruiter_list_date": "2026-10-01"
  }
}
